{
  "name": "Customer Order Management",
  "description": "Complete customer relationship management system with order processing, featuring comprehensive forms, list views, and business logic",
  "version": "1.0.0",
  "created_by": "system",
  "config": {
    "database": {
      "type": "sqlite",
      "migration_strategy": "auto"
    },
    "performance": {
      "caching_enabled": true,
      "cache_ttl_seconds": 3600
    },
    "ui": {
      "theme": "professional",
      "layout": "responsive"
    }
  },
  "entities": [
    {
      "name": "customer",
      "display_name": "Customer",
      "description": "Customer information and contact details",
      "entity_type": "Data",
      "fields": [
        {
          "name": "id",
          "display_name": "Customer ID",
          "field_type": {
            "type": "Integer",
            "min": 1
          },
          "required": true,
          "validation": [
            {
              "type": "Required",
              "message": "Customer ID is required",
              "severity": "Error"
            }
          ],
          "ui_config": {
            "component_type": "input",
            "label": "Customer ID",
            "visibility": "Visible",
            "edit_mode": "ReadOnly"
          }
        },
        {
          "name": "first_name",
          "display_name": "First Name",
          "field_type": {
            "type": "String",
            "max_length": 50
          },
          "required": true,
          "validation": [
            {
              "type": "Required",
              "message": "First name is required",
              "severity": "Error"
            },
            {
              "type": "MinLength",
              "message": "First name must be at least 2 characters",
              "severity": "Error"
            }
          ],
          "ui_config": {
            "component_type": "input",
            "label": "First Name",
            "placeholder": "Enter first name",
            "visibility": "Visible",
            "edit_mode": "Editable"
          }
        },
        {
          "name": "last_name",
          "display_name": "Last Name",
          "field_type": {
            "type": "String",
            "max_length": 50
          },
          "required": true,
          "validation": [
            {
              "type": "Required",
              "message": "Last name is required",
              "severity": "Error"
            }
          ],
          "ui_config": {
            "component_type": "input",
            "label": "Last Name",
            "placeholder": "Enter last name",
            "visibility": "Visible",
            "edit_mode": "Editable"
          }
        },
        {
          "name": "email",
          "display_name": "Email Address",
          "field_type": {
            "type": "String",
            "max_length": 255
          },
          "required": true,
          "validation": [
            {
              "type": "Required",
              "message": "Email address is required",
              "severity": "Error"
            },
            {
              "type": "Pattern",
              "message": "Please enter a valid email address",
              "severity": "Error"
            }
          ],
          "ui_config": {
            "component_type": "input",
            "label": "Email Address",
            "placeholder": "customer@example.com",
            "help_text": "We'll use this to send order confirmations",
            "visibility": "Visible",
            "edit_mode": "Editable"
          }
        },
        {
          "name": "phone",
          "display_name": "Phone Number",
          "field_type": {
            "type": "String",
            "max_length": 20
          },
          "required": false,
          "validation": [
            {
              "type": "Pattern",
              "message": "Please enter a valid phone number",
              "severity": "Warning"
            }
          ],
          "ui_config": {
            "component_type": "input",
            "label": "Phone Number",
            "placeholder": "+1 (555) 123-4567",
            "visibility": "Visible",
            "edit_mode": "Editable"
          }
        },
        {
          "name": "address",
          "display_name": "Address",
          "field_type": {
            "type": "String",
            "max_length": 255
          },
          "required": false,
          "ui_config": {
            "component_type": "textarea",
            "label": "Address",
            "placeholder": "Street address, city, state, ZIP",
            "visibility": "Visible",
            "edit_mode": "Editable"
          }
        },
        {
          "name": "customer_type",
          "display_name": "Customer Type",
          "field_type": {
            "type": "Enum",
            "values": ["Individual", "Business", "Premium", "Enterprise"]
          },
          "required": true,
          "default_value": "Individual",
          "ui_config": {
            "component_type": "select",
            "label": "Customer Type",
            "visibility": "Visible",
            "edit_mode": "Editable"
          }
        },
        {
          "name": "registration_date",
          "display_name": "Registration Date",
          "field_type": {
            "type": "DateTime"
          },
          "required": true,
          "default_value": "now()",
          "ui_config": {
            "component_type": "datetime",
            "label": "Registration Date",
            "visibility": "Visible",
            "edit_mode": "ReadOnly"
          }
        },
        {
          "name": "active",
          "display_name": "Active",
          "field_type": {
            "type": "Boolean"
          },
          "required": true,
          "default_value": true,
          "ui_config": {
            "component_type": "checkbox",
            "label": "Active Customer",
            "visibility": "Visible",
            "edit_mode": "Editable"
          }
        }
      ],
      "constraints": [
        {
          "type": "PrimaryKey",
          "name": "pk_customer_id",
          "fields": ["id"]
        },
        {
          "type": "UniqueKey",
          "name": "uk_customer_email",
          "fields": ["email"],
          "message": "Email address must be unique"
        }
      ],
      "indexes": [
        {
          "name": "idx_customer_email",
          "fields": ["email"],
          "type": "BTree",
          "unique": true
        },
        {
          "name": "idx_customer_type",
          "fields": ["customer_type"],
          "type": "BTree",
          "unique": false
        }
      ],
      "ui_config": {
        "icon": "user",
        "color": "#3B82F6",
        "list_view": {
          "columns": ["first_name", "last_name", "email", "customer_type", "registration_date", "active"],
          "default_sort": {
            "field": "last_name",
            "direction": "asc"
          },
          "page_size": 25,
          "filters": [
            {
              "field": "customer_type",
              "type": "select",
              "label": "Customer Type"
            },
            {
              "field": "active",
              "type": "select",
              "label": "Status"
            },
            {
              "field": "registration_date",
              "type": "date",
              "label": "Registration Date"
            }
          ]
        },
        "detail_view": {
          "layout": "Single",
          "sections": [
            {
              "title": "Basic Information",
              "fields": ["first_name", "last_name", "email", "phone"]
            },
            {
              "title": "Address & Details",
              "fields": ["address", "customer_type", "registration_date", "active"]
            }
          ]
        },
        "form_view": {
          "layout": "Single",
          "validation": {
            "client_side": true,
            "server_side": true,
            "real_time": true
          }
        }
      },
      "behavior": {
        "auditing": {
          "enabled": true,
          "track_changes": true,
          "track_access": false
        },
        "caching": {
          "enabled": true,
          "ttl_seconds": 3600
        }
      }
    },
    {
      "name": "order",
      "display_name": "Order",
      "description": "Customer orders with items and payment information",
      "entity_type": "Data",
      "fields": [
        {
          "name": "id",
          "display_name": "Order ID",
          "field_type": {
            "type": "Integer",
            "min": 1
          },
          "required": true,
          "validation": [
            {
              "type": "Required",
              "message": "Order ID is required",
              "severity": "Error"
            }
          ],
          "ui_config": {
            "component_type": "input",
            "label": "Order ID",
            "visibility": "Visible",
            "edit_mode": "ReadOnly"
          }
        },
        {
          "name": "customer_id",
          "display_name": "Customer",
          "field_type": {
            "type": "Reference",
            "entity": "customer"
          },
          "required": true,
          "validation": [
            {
              "type": "Required",
              "message": "Customer is required",
              "severity": "Error"
            }
          ],
          "ui_config": {
            "component_type": "select",
            "label": "Customer",
            "visibility": "Visible",
            "edit_mode": "Editable"
          }
        },
        {
          "name": "order_date",
          "display_name": "Order Date",
          "field_type": {
            "type": "DateTime"
          },
          "required": true,
          "default_value": "now()",
          "ui_config": {
            "component_type": "datetime",